{
  "contractVersion": "archidom.layout-document/0.2",
  "documentId": "layout.kora.liquid-station",
  "projectId": "project.kora.food-hall",
  "name": "KORA Liquid Station — owner intent",
  "canonicalUnits": "mm",
  "stateRevision": 0,
  "floor": {
    "id": "floor.kora.main",
    "label": "Liquid Station",
    "elevationMm": 0,
    "clearHeightMm": 3000
  },
  "variant": {
    "id": "variant.kora.owner-intent",
    "label": "Owner intent 2026-08-04",
    "status": "review"
  },
  "nodes": [
    {
      "id": "node.kora.nw",
      "xMm": 0,
      "yMm": 3000,
      "locked": true
    },
    {
      "id": "node.kora.ne",
      "xMm": 8100,
      "yMm": 3000,
      "locked": true
    },
    {
      "id": "node.kora.se",
      "xMm": 8100,
      "yMm": 0,
      "locked": true
    },
    {
      "id": "node.kora.sw",
      "xMm": 0,
      "yMm": 0,
      "locked": true
    }
  ],
  "walls": [
    {
      "id": "wall.kora.rear",
      "startNodeId": "node.kora.nw",
      "endNodeId": "node.kora.ne",
      "thicknessMm": 100,
      "heightMm": 3000,
      "kind": "existing",
      "locked": true,
      "label": "Задняя стена"
    },
    {
      "id": "wall.kora.right",
      "startNodeId": "node.kora.ne",
      "endNodeId": "node.kora.se",
      "thicknessMm": 100,
      "heightMm": 3000,
      "kind": "existing",
      "locked": true,
      "label": "Правая сплошная стена"
    },
    {
      "id": "wall.kora.front",
      "startNodeId": "node.kora.se",
      "endNodeId": "node.kora.sw",
      "thicknessMm": 100,
      "heightMm": 1100,
      "kind": "partition",
      "locked": true,
      "label": "Фронтальная стойка"
    },
    {
      "id": "wall.kora.left",
      "startNodeId": "node.kora.sw",
      "endNodeId": "node.kora.nw",
      "thicknessMm": 100,
      "heightMm": 3000,
      "kind": "existing",
      "locked": true,
      "label": "Левая сторона"
    }
  ],
  "openings": [
    {
      "id": "opening.kora.rear-door",
      "parentWallId": "wall.kora.rear",
      "kind": "door",
      "offsetMm": 3235,
      "widthMm": 1200,
      "heightMm": 2100,
      "sillMm": 0,
      "handing": "double",
      "locked": true,
      "label": "Дверь на оси колонны"
    },
    {
      "id": "opening.kora.left-access",
      "parentWallId": "wall.kora.left",
      "kind": "free_opening",
      "offsetMm": 0,
      "widthMm": 1500,
      "heightMm": 3000,
      "sillMm": 0,
      "handing": "none",
      "locked": true,
      "label": "Левый открытый участок 1500"
    }
  ],
  "columns": [
    {
      "id": "column.kora.center",
      "xMm": 3835,
      "yMm": 1125,
      "widthMm": 250,
      "depthMm": 250,
      "baseZMm": 0,
      "heightMm": 3000,
      "rotationDeg": 0,
      "locked": true,
      "label": "Существующая колонна"
    }
  ],
  "objects": [
    {
      "id": "object.kora.counter",
      "kind": "counter",
      "xMm": 4050,
      "yMm": 400,
      "zMm": 0,
      "widthMm": 7000,
      "depthMm": 700,
      "heightMm": 1100,
      "rotationDeg": 0,
      "locked": true,
      "label": "Гостевая стойка"
    },
    {
      "id": "object.kora.worktop",
      "kind": "service",
      "xMm": 4050,
      "yMm": 700,
      "zMm": 900,
      "widthMm": 7000,
      "depthMm": 600,
      "heightMm": 40,
      "rotationDeg": 0,
      "locked": true,
      "label": "Рабочая поверхность 900"
    }
  ],
  "clearanceZones": [
    {
      "id": "clearance.kora.service",
      "label": "Рабочий проход",
      "polygon": [
        {
          "xMm": 300,
          "yMm": 900
        },
        {
          "xMm": 7800,
          "yMm": 900
        },
        {
          "xMm": 7800,
          "yMm": 1900
        },
        {
          "xMm": 300,
          "yMm": 1900
        }
      ],
      "severity": "warning",
      "relatedObjectIds": [
        "object.kora.counter",
        "object.kora.worktop"
      ]
    }
  ],
  "materials": [
    {
      "id": "material.kora.concrete",
      "labelRu": "Матовый бетон",
      "baseColor": "#77736D",
      "roughness": 0.92,
      "metalness": 0,
      "emissive": "#000000",
      "emissiveIntensity": 0,
      "provenance": "ArchiDom clean-room material"
    },
    {
      "id": "material.kora.steel",
      "labelRu": "Нержавеющая сталь",
      "baseColor": "#A8ADB0",
      "roughness": 0.28,
      "metalness": 0.9,
      "emissive": "#000000",
      "emissiveIntensity": 0,
      "provenance": "ArchiDom clean-room material"
    }
  ],
  "materialAssignments": [
    {
      "id": "assignment.kora.rear",
      "targetId": "wall.kora.rear",
      "surfaceRole": "all",
      "materialId": "material.kora.concrete"
    },
    {
      "id": "assignment.kora.right",
      "targetId": "wall.kora.right",
      "surfaceRole": "all",
      "materialId": "material.kora.concrete"
    },
    {
      "id": "assignment.kora.front",
      "targetId": "wall.kora.front",
      "surfaceRole": "all",
      "materialId": "material.kora.concrete"
    },
    {
      "id": "assignment.kora.left",
      "targetId": "wall.kora.left",
      "surfaceRole": "all",
      "materialId": "material.kora.concrete"
    },
    {
      "id": "assignment.kora.column",
      "targetId": "column.kora.center",
      "surfaceRole": "all",
      "materialId": "material.kora.concrete"
    },
    {
      "id": "assignment.kora.counter",
      "targetId": "object.kora.counter",
      "surfaceRole": "all",
      "materialId": "material.kora.concrete"
    },
    {
      "id": "assignment.kora.worktop",
      "targetId": "object.kora.worktop",
      "surfaceRole": "all",
      "materialId": "material.kora.steel"
    }
  ],
  "lights": [
    {
      "id": "light.kora.ambient",
      "kind": "ambient",
      "xMm": 4050,
      "yMm": 1500,
      "zMm": 2600,
      "color": "#FFFFFF",
      "intensity": 1.4,
      "label": "Общий свет"
    },
    {
      "id": "light.kora.task",
      "kind": "linear_proxy",
      "xMm": 4050,
      "yMm": 900,
      "zMm": 2200,
      "color": "#FFE2B8",
      "intensity": 3.2,
      "targetId": "object.kora.worktop",
      "label": "Тёплый рабочий свет"
    }
  ],
  "metadata": {
    "sourceRefs": [
      "owner-lock://selena/2026-08-04",
      "owner-lock://selena/2026-08-07-clear-height",
      "source-native://kora-liquid-station/2026-08-04"
    ],
    "warnings": [
      "PARTIAL_OWNER_LOCK",
      "DOOR_HEIGHT_AND_SWING_NOT_SITE_VERIFIED",
      "COLUMN_ABSOLUTE_AXIS_NOT_SITE_VERIFIED",
      "EQUIPMENT_SET_OUT_PENDING"
    ]
  }
}
